{
  "schema_version": "0.1.0",
  "protocol_version": "0.1.0",
  "checkpoint_id": "checkpoint-writing-001",
  "checkpoint_reason": "writing_feedback",
  "created_at": "2026-08-26T12:00:00Z",
  "session_id": "session-writing-001",
  "run_id": "run-writing-checkpoint-001",
  "segment_id": "segment-writing-001",
  "package_id": "pkg-writing-checkpoint-a",
  "package_hash": "sha256:fb34545aa89995bcf58d65310ac3fd79cd578d2372bd30e91a772f83363c1611",
  "required_evidence_refs": [
    "artifact-writing-original-001"
  ],
  "status": "awaiting_coach"
}
